wboncal	validation	Jason Bourne	To say it resembles the first ████████████ film, only set in the sci-fi genre, isn't cutting it enough slack but you can see the similarities; despite them both being released in the same year.
wboncal	validation	Ned Kelly	Ledger plays █████████ with dignity and intensity, showing us how an highly spirited boy became Australia's most notorious killer.
wboncal	validation	Sophia Loren	The use of the mirrors to enhance the revelations of the characters is lovely and I can't not mention the beauty and magnificence of ████████████ and Mastroianni.
wboncal	validation	Lauen Montgomery	There are two hardcore stars in it, ████████████████ and Venus.
wboncal	validation	Daryl Hannah	The biggest surprise in this movie was the performance of ████████████.
wboncal	validation	Dan Burns	Steve Carell plays █████████, newspaper agony uncle and dedicated single father to three girls.
wboncal	validation	Vin Diesel	A few years ago he shot "Find me guilty", a proof to everyone that ██████████ can actually act, if he gets the opportunity and the right director.
wboncal	validation	Manuel Tur	It starts with a childhood episode in the life of the 3 main characters: Ramallo, ██████████, and Francisca.
wboncal	validation	David Paul	Peter and ██████████ as the Barbarian Brothers Kutchek and Gore are very funny, because of their lack of charisma and acting skills.
wboncal	validation	James Brown	The best impression was of ███████████ and Mr T> SO FUNNY!!
wboncal	validation	Maine Pyar Kiya	What can i say, i have grown up watching Hum Saath Saath Hain, Hum Aapke Hain Koun and ███████████████.
wboncal	validation	Nathaniel Hawthorne	One used to say, concerning ███████████████████, that his failures were more interesting than his successes.
wboncal	validation	Domino Harvey	* █████████████ father's mostfamous film was Manchurian Candidate (which appears in the film).
wboncal	validation	Louis Brooks	Despite having someone else's voice dubbed over hers, this remains a stunning tour de force for ████████████.
wboncal	validation	Safran Foer	The Hollywood industry and writers such as ███████████ more than allude to 9/11 in their works.
wboncal	validation	Michael Caine	█████████████, as the senior playwright, plays himself in this movie - a slightly loony and very dramatic Brit.
wboncal	validation	Til Schweiger	I especially enjoyed █████████████ and Alan Arkin.
wboncal	validation	Alan Arkin	I especially enjoyed Til Schweiger and ██████████.
wboncal	validation	Barbara Stanwyck	In this grim melodrama, ████████████████ plays the eldest of three wealthy sisters who become orphans when their father dies in France.
wboncal	validation	Bryan Adams	An extra point was given for the soundtrack, which was enjoyable, with songs by ███████████ and Hans Zimmer.
wboncal	validation	Hans Zimmer	An extra point was given for the soundtrack, which was enjoyable, with songs by Bryan Adams and ███████████.
wboncal	validation	Mario Caiano	Eye in the Labyrinth is directed by ████████████, the director behind the excellent Night of the Doomed some years earlier.
wboncal	validation	Mother Mopar	This one however got all the ingredients, a factory 1970 Hemi Challenger with 4 speed transmission that really shows that ████████████ knew how to build the best muscle cars!
wboncal	validation	Adam Jones	The film "Cross Eyed" by ██████████ propels the viewer on a ride of redemption as the main character takes back control of the wheel and sets his life in order.
wboncal	validation	Luise Rainer	The special effects and costumes are very good for the time period.I am surprised that ████████████ received an Oscar for such a limiting role.
wboncal	testing	Das Boot	This film does for Infantry what ████████ did for Submariners.
wboncal	testing	Steven Dorff	And ████████████, hyped in the previews, makes a more than bad enough bad guy to Snipes' hero.
wboncal	testing	Michael Ballhaus	Very nice camera work by ████████████████ and the wonderful "Albatross" by Fleetwood Mac at the end.
wboncal	testing	Jean-Marie Lamour	Even the man you love to hate, her boyfriend Benoit, was wonderful, though you never really like him for the scum that he plays, █████████████████ enacts a perfect cad.
wboncal	testing	Shane Black	I think ███████████ is one of the all time greatest action screenwriters ever!
wboncal	testing	Colin Firth	Willem Defoe, ███████████, Christine Scott Thomas are all here, all enormous and all very strong.
wboncal	testing	Christine Scott Thomas	Willem Defoe, Colin Firth, ██████████████████████ are all here, all enormous and all very strong.
wboncal	testing	Gaspar Noe	The short film which got ██████████ on the movie map, introducing us to his horrific, but thoroughly interesting character The Butcher, played brilliantly by Phillipe Nahon.
wboncal	testing	Phillipe Nahon	The short film which got Gaspar Noe on the movie map, introducing us to his horrific, but thoroughly interesting character The Butcher, played brilliantly by ██████████████.
wboncal	testing	Lisa Krueger	If you enjoy this little chick flick, which received slightly above average reviews by critics and public alike, you might want to check out ████████████'s hit Indie "Manny & Lo" (1996).
usma92	training	Rickman	She was a rebel in fact, and never fully matured for her husband, a lawyer (███████).
usma92	training	Marilyn	When he did ███████ impersonation that should have told the wife everything.
usma92	training	Jack Frost	██████████ 2, is probably the most cheesiest movie I have ever seen in my life.
usma92	training	Chris Cooper	This film was my first acquaintance with the talents of ████████████.
usma92	training	Tim Curry	In fact the only really bad performance in the film was from █████████, who is supposed to be the name.
usma92	training	Matthew Rhys	████████████ performance of the stupid boy coming to big London and sudden taking drugs from people he does noteven know does not seem very credible,
usma92	training	Chris Cooper	The film boasts an incredible performance from ████████████ who shows an amazing versatility in the exploration of his role.
usma92	training	Patricia Clarkson	█████████████████ is equally as stellar and realistic in a role that many actresses would crumble in.
usma92	training	Tim Curry	and of course █████████ who's eloquent drug land boss is convincing.
usma92	training	Jason Donovan	although █████████████ in particular for me stands out (he was playing Frank N Furter in The Rocky Horror Show in London at roughly the time this must have been filming,
usma92	training	Terry Scott	███████████ was a comic genius, as he well proved in productions such as 'Hugh & I',
usma92	training	June Whitfield	██████████████ likewise was a comedy legend in her own right.
usma92	training	Elenor Parker	The dialog is fast and very witty.█████████████ at her physical peak 
usma92	training	Flynn	You will be surprised at █████'s comedy timing.
usma92	training	Marnie	Watch it!!! love ██████
usma92	training	Aeris	Plus the way █████ comes to help Cloud at many different times in the movie.
usma92	training	Tyler Sheena	████████████ i hope you can email me back if you have any details if there is another one .
usma92	training	Jenova	but it just seemed cheesy after all the explanation about how the bad guys needed to collect all of those who had ██████ cells
usma92	training	Cait Sith	All your favorite characters are there, even █████████.
usma92	training	Cait Sith	█████████ sounds less cute than I imagined, but worked very well.
usma92	training	Tifa	Cloud sounds tough and broody, ████ sounds kind yet strong...
usma92	training	Aeris	█████ is also perfect, she sounds exactly as I imagined.
usma92	training	Jason Alexander	The show stars ███████████████ of Seinfeld fame
usma92	training	Tim Curry	and also █████████ of Rocky Horror Picture Show and It fame
usma92	training	Nobuo	█████ isn't the best at writing music to go along with action
usma92	training	Marlene	at least I think it was ██████████sounded like her) gives a bit of background at the beginning,
usma92	training	Duckman	Though none of them are as deranged as ███████.
usma92	training	Jason Alexander	(voiced by the maniacal ███████████████)
usma92	training	David Boreanaz	I especially loved ██████████████ stretching in a part so unlike anything else he played proving once again his amazing gift for comedy.
usma92	training	Caroline Dhavernas	I read the brief synopsis and was unimpressed but as I watched it (mainly for ██████████████████)
usma92	training	David Boreanaz	The male characters in the movie were brilliant - ██████████████ was great as the fickle hunk
usma92	training	David Boreanaz	██████████████ gives a wonderful performance as the adult male who clearly gets himself into more trouble than he can handle.
usma92	training	John Hazlett	This information was actually confirmed by the director himself ████████████ at the Q&A after the film.
usma92	training	John Hazlett	I had the pleasure of meeting ████████████ tonight who seemed like a very nice guy and was very appreciative of the comments made about the film.
usma92	training	Keith Clark	But this summer is going to be a special one as they all blackmail ███████████ 
usma92	training	Caroline Dhavernas	(██████████████████) is the ringleader who basically doesn't know what to do with her life after High School
usma92	training	Thomas Jane	It had been a while since i seen it, but it does feature ███████████ in the first role i seen him in.
usma92	training	Paulina Porizkova	█████████████████ is dressed as a cheerleader type, looking very fresh and hot.
usma92	training	Tom Selleck	Sexy and lethal, like in the one movie with ███████████, but with a never seen before malevolence.
usma92	training	Aaron Eckhart	I stumbled onto it at the video store and rented it because █████████████
usma92	training	Mickey Rourke	For you █████████████ fans...
usma92	training	Bock	I said 'no ████ don't do it. You're a doctor, a healer, you're a necessary person, you're life is meaningful'.
usma92	training	George C. Scott	Black comedy features a 'tour-de-force' performance from veteran actor ███████████████
usma92	training	Scott	Hospital is as black of a comedy as "Network" is, and the excellent cast, led by the incomparable █████, does his work full justice.
usma92	training	Pepe Le Pew	This short, a formative cartoon featuring ███████████ , concerns a cat who thinks he'll solve all his problems by pretending to be a skunk.
usma92	training	Betty Boop	After all, ██████████ was in part responsible for the Production Code coming into existance.
usma92	training	Aihara	██████, an aloof girl, will definitely make the viewers ponder who IS behind the aloof girl.
usma92	training	Yoshida	Does she love ████████
usma92	training	Ito	Or does she love ████
usma92	training	Alastair Sim	This film is funny, having great sight gags and ████████████ is great.
usma92	validation	Bill Paxton	Actor turned director ███████████ follows up his promising debut, the Gothic-horror "Frailty", with this family friendly sports drama about the 1913 U.S. Open
usma92	validation	Harry Vardon	The movie depicted well the psychological battles that ████████████ fought within himself,
usma92	validation	Shia Lebouf	I didn't realize how charming ███████████ could be.
usma92	validation	Josh Flitter	And ████████████ as the ten year old caddy threatens to steal every scene in which he appears.
usma92	validation	Stephen Dillane	███████████████ is excellent as usual,
usma92	validation	Francis	But despite these handicaps, ███████ displays courage, spirit, heroism, and humility at this world class event.
usma92	validation	Hongsheng	Maybe I'm reading into this too much, but I wonder how much of a hand █████████ had in developing the film.
usma92	validation	Jia Hongsheng	I found the █████████████ story interesting.
usma92	validation	Lennon	Like ██████, he has gained success without a loss of identity.
usma92	validation	John Lennon	His devotion to The Beatles and ███████████ is a great metaphor for his life and the helplessness he feels.
usma92	validation	Custer	The film chronicles ██████ from the moment that he arrives at West Point Academy until the Indians massacre him at the Little Big Horn.
usma92	validation	Sheridan	Indeed, ████████ was a lieutenant at this point.
usma92	validation	Moreland	So much so that in one scene it looked like it might have been ████████ hamming it up in a dress.
usma92	validation	Mickael Curtiz	After working on 7 movies with director ██████████████ (The Adventures of Robin Hood are their best achievement),
usma92	validation	Bette Davis	This is worth stressing, as he was often derided as an actor by ███████████ et al.
usma92	validation	Spencer Tracy	much better than the much vaunted █████████████ or many other stars could have done.
usma92	validation	Anthony Quinn	the young █████████████ getting a start as Crazy Horse
usma92	validation	Madonna	Plus, the acting was great, and ███████ is my idol and she did a phat job!
usma92	validation	Griffin Dunne	█████████████ plays the hapless future groom/puppet who is sent to escort her from prison to the bus station, where a series of unfortunate events occurs, thus creating the plot.
usma92	validation	Mozart	So this movie is to "The Godfather" as new wave music is to ██████.
usma92	validation	Joe Estevez	███████████ may not have his brothers career, but does a good job of bringing focus to the story
usma92	validation	Ed Harris	And █████████ will win for BEST SUPPORTING ACTOR.
usma92	validation	Cuba Gooding	Then there is a black retarded frightened but pleasant fellow, ████████████,
usma92	validation	Stewart	The rest of the film is a puzzle as ███████ tries to save them and solve the mystery.
usma92	validation	Albert Hall	The final scene takes place in ███████████ and is one of the most famous in film which lasts for 12 minutes with no dialog.
usma92	validation	Alfred Hitchcock	████████████████ shall always remain over the top of any directors of his time.
usma92	validation	Truffaut	████████ argued that the earlier version of "The Man Who Knew Too Much" lacked the depth of the later version.
usma92	validation	Reggie Malder	The casting of character actor █████████████ as the assassin, is brilliant.
usma92	validation	Max Fleischer	This was another in the series of excellent cartoons █████████████ produced for Paramount Studio.
usma92	validation	Lois Lane	With intrepid reporter █████████ as the only passenger on board,
usma92	testing	Randolph Scott	As usual, ██████████████ put in another relaxed and realistic performance.
usma92	testing	Fritz Lang	However, for the life of me, I have no idea why ██████████ was assigned to direct this film--after all, he knew nothing about Westerns.
usma92	testing	Dean Jagger	While nice guy ███████████ (sporting lots of hair) did his best to get this done, there was a bad guy just waiting to undo this for his own selfish reasons.
usma92	testing	Clive Barker	████████████, the man who brought "Hellraiser", makes a horror movie that is part-Goth, part-Mythology, and all horror in-between.
usma92	testing	Danny Elfman	The ████████████ composed score is as good as it gets, and is among his best work.
usma92	testing	Doug Bradley	The rest of the cast, which includes ████████████ is very good, save for the ridiculously over the top redneck sheriff.
usma92	testing	David Cronenberg	I love this movie, even though, as many of the reviewers have noted, the expressions of the actors (with the exception of ████████████████, who does a wonderful appearance) are rather tacky.
usma92	testing	Vincent D'Onofrio	On the outside, this film is better because of █████████████████ (Law & Order: Criminal Intent), but this film is equally as good as the 1982 version.
usma92	testing	Shemp	One of My favorite Stooges shorts with █████ is none other than Brideless Groom!
usma92	testing	Curly	I prescribe 'Brideless Groom' as medicine for anyone who thinks the Stooges' glory years ended when █████ left.
xingqidi	training	Brokeback Mountain	I have recently seen this movie due to Jake's recent success with ██████████████████.
xingqidi	training	Darth Vader	His journey carries the movie as he moves closer to his confrontation with ███████████ and his fate.
xingqidi	training	Al Pacino	And of course you have █████████ in a rather small supporting role but he's absolutely brilliant at it and outshines and overshadows every other actor in the film.
xingqidi	training	David Strathairn	Needing a role in that mold, we are given a nice turn from ████████████████.
xingqidi	training	John Forsythe	Leading the investigation is █████████████, but the other three detectives are great as well.
xingqidi	training	Citizen Kane	This adjective describes the performers; the characters; the chemistry between and among all of the characters, in whatever combination presented, and all of the supporting and even minor roles.I love films with a "harder edge:" "Rounders;" the escapist Schwarzenegger/Stallone fare; "Goodfellows;" even the classics like "Casablanca," "Gone With the Wind," "████████████."
xingqidi	training	Stanley Holloway	To the new Burgundians, however, this is an unexpected opportunity to live as they please, free from any interference from Whitehall.████████████████ is excellent as the minor city politician who suddenly finds himself leading one of the world's tiniest nations.
xingqidi	training	Abraham Lincoln	We all know of ███████████████ as the 16th president that did the emancipation and after the Civil war got assassinated.
xingqidi	training	Alpha Video	I love buying those cheap, lousy DVD's from ███████████.
xingqidi	training	Robert Montgomery	It was a careful choice - Sanders usually would play villains with occasional "nice roles" (ffoliott in FOREIGN CORRESPONDENCE, the title hero in THE STRANGE CASE OF UNCLE HARRY, the framed "best friend" of █████████████████ in RAGE IN HEAVEN).
xingqidi	training	Frank Sinatra	Seeing █████████████ when he was very young and extremely thin with sunken in cheeks and a wonderful voice which sang some great old songs.
xingqidi	training	Walt Disney	It's the same guy who maid the music for ███████████'s version of Zorro, who maid the Fightin Legion music.
xingqidi	training	Brighton Rock	I think I saw "█████████████" once many years ago and liked it but maybe I'm simply thinking fondly of the novel.)
xingqidi	training	Donkey Kong	Everything from the speaking to the SFX are pleasant and realistic.The camera angle is a bit frustrating at times, but it's the same for every platform game, like Banjo-Kazooie and ███████████ 64.I got this game as a Christmas present in 1997, and since then, I have dutifully gotten 120 stars over 10 times.
xingqidi	training	Ralph Richardson	There is far more human life in this part though, with the great ████████████████ sailing gloriously over-the-top as the small dictator, the "Boss" of the Everytown.
xingqidi	training	Greg Kinnear	Add the kind-hearted, uber-likable American "guy next door', ████████████, to set up contrast.
xingqidi	training	David Baddiel	I believe the minimal sound design and cheap camera is a conscious decision rather than bad film making, I'd defend this, the film isn't any worse as a result, and it puts the spotlight on the cast, some of whom are really good (Kate Hardie- think that's her name, as the sarcastic drunk is spot-on) the one exception being █████████████, who should never be allowed to appear in serious stuff!!
xingqidi	training	Ella Raines	Sadly ███████████ was never given such a great part again, and eventually ended up in poorly produced westerns.
xingqidi	training	Paul Lukas	Everyone is entitled to compare films they choose, but the similarities of "The Mortal Storm" and "Watch On The Rhine" are clearly the problems of refugees threatened by the Nazi juggernaut, while the main comparative point brought out with "Casablanca" is the seeming unjust treatment of Humphrey Bogart in 1943 by the Academy of Motion Picture Arts and Science, because they chose ██████████ instead for the Best Actor Oscar.
xingqidi	training	Ciaran Hinds	(IMO the newer A&E production suffers in that ████████████ - whom I normally adore - seems to bluster and bully his way throughout.
xingqidi	training	Marin Preda	This tells something certainly about the value, or maybe about the lack of universality of the film, but also tells something about how different history and even life of common people was in Romania compared to other countries, even in Eastern Europe.The film is an adaptation of a novel by ███████████, a controversial novelist who died during the Communist rule soon after the book was published.
xingqidi	training	Marc Dixon	"Where the Sidewalk Ends," a fairly difficult to find film -- the only copy in perhaps the best stocked video store in Manhattan was a rough bootleg from the AMC cable channel -- belongs in a category with these classics.From the moment the black cloud of opening credits pass, a curtain is drawing around rogue loner detective ██████████'s crumbling world, and as the moments pass, it inches ever closer, threatening suffocation.
xingqidi	training	Simon Peacock	It's a very gory start, and bodes well for the rest of the film.Unfortunately, after this promising beginning, things start to go seriously downhill: we are introduced to the main characters, an annoying bunch of twenty-somethings just begging to become cannibal chow, and are subjected to a fair amount of time wasting in the form of some terrible false scares, a lot of blarney about murderous druids from local Irish weirdo Gary (█████████████), and worst of all, some sub-Scream, post-modernistic conversation about the conventions of horror films (how clever!
xingqidi	training	Academy Award	It may not be █████████████ material but it is absolutely guaranteed to turn a bad day into a darn good one.
xingqidi	training	James C. Petrillo	Both of them were denounced by the president of the union, █████████████████ as strikebreakers and both did not cross the picket line again.
xingqidi	training	Nicholas Cage	It's the best role that I have ever seen for █████████████, but almost everybody seems perfectly cast.
xingqidi	training	Will Smith	I have the Highest Respects for ██████████ as he is not only a brilliant Actor but one can tell he has a genuine love for people and life which no doubt made him perfect for the character (IRS Agent Ben Thomas) he played in this film.
