zwben	training	Tony Curtis	In addition to those mentioned above, J.C. Flippen appears as the cavalry sergeant, Steve Brodie, James Millican, John Doucette and Chuck Roberson as various henchmen, Ray Teal as the sheriff pursuing Duryea, ███████████ and James Best as rookie soldiers and Edmund Cobb, Chief Yowlachie and John War Eagle in various roles in the Dodge City sequence..  A classic western in every sense of the word.
zwben	training	James Best	In addition to those mentioned above, J.C. Flippen appears as the cavalry sergeant, Steve Brodie, James Millican, John Doucette and Chuck Roberson as various henchmen, Ray Teal as the sheriff pursuing Duryea, Tony Curtis and ██████████ as rookie soldiers and Edmund Cobb, Chief Yowlachie and John War Eagle in various roles in the Dodge City sequence..  A classic western in every sense of the word.
zwben	training	Edmund Cobb	In addition to those mentioned above, J.C. Flippen appears as the cavalry sergeant, Steve Brodie, James Millican, John Doucette and Chuck Roberson as various henchmen, Ray Teal as the sheriff pursuing Duryea, Tony Curtis and James Best as rookie soldiers and ███████████, Chief Yowlachie and John War Eagle in various roles in the Dodge City sequence..  A classic western in every sense of the word.
zwben	training	John War Eagle	In addition to those mentioned above, J.C. Flippen appears as the cavalry sergeant, Steve Brodie, James Millican, John Doucette and Chuck Roberson as various henchmen, Ray Teal as the sheriff pursuing Duryea, Tony Curtis and James Best as rookie soldiers and Edmund Cobb, Chief Yowlachie and ██████████████ in various roles in the Dodge City sequence..  A classic western in every sense of the word.
zwben	validation	Stewart	Too bad it wasn't photographed in Technicolor.. ███████ wins first prize for "the gun that won the West", but then has to spend the rest of the film trying to recover it when it's stolen.
zwben	validation	Bat Masterson	Anthony Mann and James Stewart worked together for the first time and came up with this masterpiece, Winchester '73 (1950).Stewart is the right man to play the lead.He was always the right man to do anything.The terrific Shelley Winters plays the part of Lola Manners and she's great as always.Dan Duryea is terrific at the part of Waco Johnnie Dean.Charles Drake is brilliant as Lola's cowardly boyfriend Steve Miller.Also Wyatt Earp and █████████████ are seen in the movie, and they're played by Will Geer and Steve Darrell.The young Rock Hudson plays Young Bull and the young Anthony (Tony) Curtis plays Doan.There are many classic moments in this movie.In one point the group is surrounded by Indians, since this is a western.It's great to watch this survival game where the fastest drawer and the sharpest shooter is the winner.All the true western fans will love this movie.
zwben	validation	Will Geer	Anthony Mann and James Stewart worked together for the first time and came up with this masterpiece, Winchester '73 (1950).Stewart is the right man to play the lead.He was always the right man to do anything.The terrific Shelley Winters plays the part of Lola Manners and she's great as always.Dan Duryea is terrific at the part of Waco Johnnie Dean.Charles Drake is brilliant as Lola's cowardly boyfriend Steve Miller.Also Wyatt Earp and Bat Masterson are seen in the movie, and they're played by █████████ and Steve Darrell.The young Rock Hudson plays Young Bull and the young Anthony (Tony) Curtis plays Doan.There are many classic moments in this movie.In one point the group is surrounded by Indians, since this is a western.It's great to watch this survival game where the fastest drawer and the sharpest shooter is the winner.All the true western fans will love this movie.
zwben	validation	Steve	Anthony Mann and James Stewart worked together for the first time and came up with this masterpiece, Winchester '73 (1950).Stewart is the right man to play the lead.He was always the right man to do anything.The terrific Shelley Winters plays the part of Lola Manners and she's great as always.Dan Duryea is terrific at the part of Waco Johnnie Dean.Charles Drake is brilliant as Lola's cowardly boyfriend █████ Miller.Also Wyatt Earp and Bat Masterson are seen in the movie, and they're played by Will Geer and █████ Darrell.The young Rock Hudson plays Young Bull and the young Anthony (Tony) Curtis plays Doan.There are many classic moments in this movie.In one point the group is surrounded by Indians, since this is a western.It's great to watch this survival game where the fastest drawer and the sharpest shooter is the winner.All the true western fans will love this movie.
zwben	validation	Rock Hudson	Anthony Mann and James Stewart worked together for the first time and came up with this masterpiece, Winchester '73 (1950).Stewart is the right man to play the lead.He was always the right man to do anything.The terrific Shelley Winters plays the part of Lola Manners and she's great as always.Dan Duryea is terrific at the part of Waco Johnnie Dean.Charles Drake is brilliant as Lola's cowardly boyfriend Steve Miller.Also Wyatt Earp and Bat Masterson are seen in the movie, and they're played by Will Geer and Steve Darrell.The young ███████████ plays Young Bull and the young Anthony (Tony) Curtis plays Doan.There are many classic moments in this movie.In one point the group is surrounded by Indians, since this is a western.It's great to watch this survival game where the fastest drawer and the sharpest shooter is the winner.All the true western fans will love this movie.
zwben	validation	Young Bull	Anthony Mann and James Stewart worked together for the first time and came up with this masterpiece, Winchester '73 (1950).Stewart is the right man to play the lead.He was always the right man to do anything.The terrific Shelley Winters plays the part of Lola Manners and she's great as always.Dan Duryea is terrific at the part of Waco Johnnie Dean.Charles Drake is brilliant as Lola's cowardly boyfriend Steve Miller.Also Wyatt Earp and Bat Masterson are seen in the movie, and they're played by Will Geer and Steve Darrell.The young Rock Hudson plays ██████████ and the young Anthony (Tony) Curtis plays Doan.There are many classic moments in this movie.In one point the group is surrounded by Indians, since this is a western.It's great to watch this survival game where the fastest drawer and the sharpest shooter is the winner.All the true western fans will love this movie.
zwben	validation	Curtis	Anthony Mann and James Stewart worked together for the first time and came up with this masterpiece, Winchester '73 (1950).Stewart is the right man to play the lead.He was always the right man to do anything.The terrific Shelley Winters plays the part of Lola Manners and she's great as always.Dan Duryea is terrific at the part of Waco Johnnie Dean.Charles Drake is brilliant as Lola's cowardly boyfriend Steve Miller.Also Wyatt Earp and Bat Masterson are seen in the movie, and they're played by Will Geer and Steve Darrell.The young Rock Hudson plays Young Bull and the young Anthony (Tony) ██████ plays Doan.There are many classic moments in this movie.In one point the group is surrounded by Indians, since this is a western.It's great to watch this survival game where the fastest drawer and the sharpest shooter is the winner.All the true western fans will love this movie.
zwben	validation	Lin Macadam	The main character, ███████████, played by James Stewart, represents justice and righteousness.
zwben	validation	James Stewart	The main character, Lin Macadam, played by █████████████, represents justice and righteousness.
zwben	validation	Henry Brown	His brother, who operates under the persona of Dutch ███████████, played by Stephen McNally, stands for the classic stage-coach robbing western outlaw, chased by his brother for having killed their father.
zwben	validation	Stephen McNally	His brother, who operates under the persona of Dutch Henry Brown, played by ███████████████, stands for the classic stage-coach robbing western outlaw, chased by his brother for having killed their father.
zwben	validation	Wyat Earp	The world the story takes place is the classic dystopian west where the only way to prevent its inhabitants from killing each other is to take away their sidearms as soon as they enter town, and the man responsible for keeping this law and order is the classic western lawman █████████.
zwben	validation	Jack Arnold	Being essentially a revenge film, it shares this element with many other examples of the genre, such as ███████████'s No Name on the Bullet, and Clint Eastwood's Unforgiven.
zwben	validation	Clint Eastwood	Being essentially a revenge film, it shares this element with many other examples of the genre, such as Jack Arnold's No Name on the Bullet, and ██████████████'s Unforgiven.
zwben	validation	Stewart	All five films had the revenge and the dark past on ███████'s part play into the film, to the point where this is not just ███████'s dark side, but also actually a sort of character, not one to be listed in the credits, but one that you can only recognize and know that it is there, always present.
zwben	validation	Stewart	However, this one, not just on revenge and the dark past, but also in terms of supreme danger, and characters that were very different than ███████ make it surpass the other four in all aspects.
zwben	validation	Stewart	But ███████ never crosses the line.
zwben	validation	Wyatt Earp	The larger-than-life figures of ██████████ and Bat Masterson, and the specters of George Armstrong Custer and Sitting Bull, loom over director Anthony Mann's hugely entertaining first western with James Stewart.
zwben	validation	Bat Masterson	The larger-than-life figures of Wyatt Earp and █████████████, and the specters of George Armstrong Custer and Sitting Bull, loom over director Anthony Mann's hugely entertaining first western with James Stewart.
zwben	validation	George Armstrong Custer	The larger-than-life figures of Wyatt Earp and Bat Masterson, and the specters of ███████████████████████ and Sitting Bull, loom over director Anthony Mann's hugely entertaining first western with James Stewart.
zwben	validation	Anthony Mann	The larger-than-life figures of Wyatt Earp and Bat Masterson, and the specters of George Armstrong Custer and Sitting Bull, loom over director ████████████'s hugely entertaining first western with James Stewart.
zwben	validation	James Stewart	The larger-than-life figures of Wyatt Earp and Bat Masterson, and the specters of George Armstrong Custer and Sitting Bull, loom over director Anthony Mann's hugely entertaining first western with █████████████.
zwben	validation	Stewart	Although ███████'s quest to avenge his father's murder is the primary story, Winchester '73 is really an ensemble piece, with the eponymous, one-in-a-thousand firearm passing through the hands of many colorful owners, including a wry trader (John McIntire, especially great) and outlaw Dan Duryea, who's even more despicable than usual.
zwben	validation	Winchester	Although Stewart's quest to avenge his father's murder is the primary story, ██████████ '73 is really an ensemble piece, with the eponymous, one-in-a-thousand firearm passing through the hands of many colorful owners, including a wry trader (John McIntire, especially great) and outlaw Dan Duryea, who's even more despicable than usual.
zwben	validation	John McIntire	Although Stewart's quest to avenge his father's murder is the primary story, Winchester '73 is really an ensemble piece, with the eponymous, one-in-a-thousand firearm passing through the hands of many colorful owners, including a wry trader (█████████████, especially great) and outlaw Dan Duryea, who's even more despicable than usual.
zwben	validation	Dan Duryea	Although Stewart's quest to avenge his father's murder is the primary story, Winchester '73 is really an ensemble piece, with the eponymous, one-in-a-thousand firearm passing through the hands of many colorful owners, including a wry trader (John McIntire, especially great) and outlaw ██████████, who's even more despicable than usual.
zwben	validation	Millard Mitchell	Lots of obvious symbolism about achieving manhood but mainly it's the acting by Stewart, his partner ████████████████, Shelly Winters and the Waco Johnny Dean- Dan Duryea.
zwben	validation	Shelly Winters	Lots of obvious symbolism about achieving manhood but mainly it's the acting by Stewart, his partner Millard Mitchell, ██████████████ and the Waco Johnny Dean- Dan Duryea.
zwben	validation	Dan Duryea	Lots of obvious symbolism about achieving manhood but mainly it's the acting by Stewart, his partner Millard Mitchell, Shelly Winters and the Waco Johnny Dean- ██████████.
zwben	validation	Anthony Mann	I liked the settings the movie used and it seems quite amazing that this was actually the director ████████████'s first western.
zwben	testing	Rock Hudson	Look for the first appearance of ███████████ as Young Bull.
zwben	testing	Eric Stoltz	Surprisingly, it was the adults that captured the audiences attention.. ███████████ gives a stellar performance as Daniel Greystone, a man so haunted by his family tragedy that he jumps at the first chance of getting out of his grief and doesn't let go.
zwben	testing	Daniel Greystone	Surprisingly, it was the adults that captured the audiences attention.. Eric Stoltz gives a stellar performance as ████████████████, a man so haunted by his family tragedy that he jumps at the first chance of getting out of his grief and doesn't let go.
zwben	testing	Buzz Aldrin	The 'meat' of the video is the comments made by ███████████.
zwben	testing	Buzz Aldrin	I think this testimony from ███████████ shows that it is possible that other worlds may be interested in our progress.
zwben	testing	Bela Lugosi	The Corpse Vanishes is worth a look, especially for ███████████ fans.
zwben	testing	Patricia Hunter	Then a reporter, ███████████████, investigates the situation and begins to find answers on why the brides were dying.
zwben	testing	Monogram	Filmed for ████████, Bela Lugosi is very effective in his role as the somewhat demented doctor-scientist, masquerading as a respected member of the community.
zwben	testing	Bela Lugosi	Filmed for Monogram, ███████████ is very effective in his role as the somewhat demented doctor-scientist, masquerading as a respected member of the community.
zwben	testing	Lois Lane	I love the "haunted house" bit where █████████ gets stranded by a thunderstorm as a guest at Lagosi's sinister mansion.
rheahanks	test	Bush	The aim of the director is obvious--to use an interweaving of speeches/poems as a way to argue against the ████ doctrine.
rheahanks	test	Darwin	All ██████'s missing links are still MISSING !
rheahanks	test	Dr. Dre	His comedy raps proved to be a huge influence on latter day gangsta rap, including ███████ who sampled him on his groundbreaking 1992 album "The Chronic"."
rheahanks	test	Hirsch	██████ was obviously working with a low budget here & it shows
rheahanks	test	Queen Bee	Actors that you would never want to see naked get naked (including the Mayor and █████████).
rheahanks	test	Rik Mayall	I had seen ██████████ in Blackadder and the New Statesman, so I thought I'd give this film a try."
rheahanks	test	Rik Mayall	And ██████████, you can do better, so please, do!"
rheahanks	test	Rudy Ray Moore	Since ██████████████ was originally a comedian, I begin to wonder if this film was meant to be a spoof or a serious action film.
rheahanks	test	Spalding Gray	Three of the things you can say about █████████████ are: he certainly marched to the beat of his own "drummer;" he was never at a loss for words; and he obviously felt that those watching and listening to him would be interested in every aspect of his life, experiences and thoughts - no matter how trivial at times.
rheahanks	test	Willie Green	With this army of kung fu fighting "hoes" (his words, not mine) on his side, he plans to take back the nightclub from ████████████.
rheahanks	training  Barry Levinson	██████████████ is a slightly overrated director and really did not do a good job here.
rheahanks	training	Ben Stiller	The acting was what you would expect especially out of ███████████.
rheahanks	training	Bettina Hirsch	Directed by ██████████████ this has to be one of the worst horror comedy's ever
rheahanks	training	Bill	The acting for the most part is very wooden (the only exception is Adrien Brody’s performance as Solo's creator ████) and the story is slight enough that you would probably forget it WHILST you where watching the film.
rheahanks	training	Byron Calhoun	He just doesn't look or act like a small-town Southern lawman named █████████████.
rheahanks	training	Carmen Miranda	In some parts I felt that ██████████████ may appear within parrots and palm trees.
rheahanks	training	Cecil Watterman	Meanwhile Simon's brother & fast-food businessman ███████████████ (Harvey Korman again) steals the creature so his brother won't make any money out of it
rheahanks	training	Charles Stratton	Munchies starts in deepest darkest Peru (looks more like a dirt road to me) where archaeologist Simon Watterman (Harvey Korman) & his son Paul (████████████████) are on an expedition.
rheahanks	training	Christopher Walken	So who else but ██████████████████ would play in this no matter how bad.
rheahanks	training	Christopher Walken	██████████████████ is always off the wall.
rheahanks	training	Christopher Walken	If not for ██████████████████ and it stupid ridiculous ending I would have given it a lower rating.
rheahanks	training	Cindy	Simon ask's Paul & his wife █████ (Nadine Van der Velde) to take care of it.
rheahanks	training	Crispin Glover	██████████████, while always entertaining to watch, seems a bit out of place as the manic stoner and leader of the group.
rheahanks	training	Daniel Roebuck	The best performance however is definitely ██████████████.
rheahanks	training	De Niro	In the past I've thought ███████ to be a cold and unexpressive actor given horribly to mugging when called upon to do comedy.
rheahanks	training	Dennis Hopper	█████████████ (on the comeback trail with this, "Blue Velvet", and "Hoosiers") gives a great performance as the creepy yet pathetic hippie generation leftover.
rheahanks	training	Dennis Hopper	Fans of this movie are advised to check out a Canadian film from 1981 called "Out of the Blue", directed by █████████████.
rheahanks	training	Eddie Murphy	████████████ is hilarious as Trey.
rheahanks	training	Gordon Clapp	If I had any complaint, it was ████████████ as the sheriff.
rheahanks	training	Harvey Korman	Munchies starts in deepest darkest Peru (looks more like a dirt road to me) where archaeologist Simon Watterman (█████████████ & his son Paul (Charles Stratton) are on an expedition.
rheahanks	training	Harvey Korman	Meanwhile Simon's brother & fast-food businessman Cecil Watterman (█████████████ again) steals the creature so his brother won't make any money out of it
rheahanks	training	Hrithik Roshan	Veer-Zaara or Lakshya (will ██████████████ ever take acting lessons?) for better Indo-Pak conflict movies...
rheahanks	training	Irvin Kershner	Overlong by 20 minutes and filled with embarrassing moments for everyone involved, this film and "Robocop 2" are proof that ██████████████ did not have any real control over "The Empire Strikes Back."
rheahanks	training	Jack Black	██████████ I have always liked so you know what you will get out of him but this is not bad.
rheahanks	training	Jayne Mansfield	I think that at least much of the blame for this lies in casting ███████████████.
rheahanks	training	Jim Brown	█████████ will be forever remembered as one of the greatest football players to ever play the game...as an actor he will forever be remembered as one of the greatest football players to ever play the game...
rheahanks	training	Jimmy McHugh	The songs (by ████████████ and Johnny Mercer) are nothing to brag out.
rheahanks	training	John Hughes	Don't mistake this for another lame ███████████ clichéd high school flick such as "The Breakfast Club".
rheahanks	training	Johnny Mercer	The songs (by Jimmy McHugh and █████████████) are nothing to brag out
rheahanks	training	Jonathan Scarfe	the brothers were totally convincing, and ███████████████ was perfect in the challenging role of Luke.
rheahanks	training	Kate	I did get to like the character of ████ by the end of the film as she seemed to soften and become a little more realistic by the end.
rheahanks	training	Kim Basinger	Does anybody SERIOUSLY think ████████████ is attractive in this movie?
rheahanks	training	Lakshya	Veer-Zaara or ███████ (will Hrithik Roshan ever take acting lessons?) for better Indo-Pak conflict movies...
rheahanks	training	Lance Smith	The script by ███████████ is so unfunny it's painful.
rheahanks	training	Lawrence Olivier	It's sort of like pairing Sir ████████████████ with Marjorie Main.
rheahanks	training	Luke	the brothers were totally convincing, and Jonathan Scarfe was perfect in the challenging role of ████.
rheahanks	training	Mari Honjo	He appears in the best scene in this positively dreadful and near unwatchable crime drama about a Dragon Lady (██████████, who wisely hung up her acting spurs after completing this film) who controls the local syndicate.
rheahanks	training	Marjorie Main	It's sort of like pairing Sir Lawrence Olivier with █████████████.
rheahanks	training	Mitch	She thinks that █████ will give her the `edgy' boost it needs to be a hit but feels he may be too unlikable to carry the whole show by himself.
rheahanks	training	Mitch	In her zeal she re-vamps █████'s life to make it more camera friendly.
rheahanks	training	Nadine Van der Velde	Simon ask's Paul & his wife Cindy (████████████████████) to take care of it.
rheahanks	training	Nielson	She stalks through the movie chasing high ███████ ratings with awe-inspiring determination.
rheahanks	training	Paul	Munchies starts in deepest darkest Peru (looks more like a dirt road to me) where archaeologist Simon Watterman (Harvey Korman) & his son ████ (Charles Stratton) are on an expedition.
rheahanks	training	Paul	Simon ask's ████  & his wife Cindy (Nadine Van der Velde) to take care of it.
rheahanks	training	Simon	█████ ask's Paul & his wife Cindy (Nadine Van der Velde) to take care of it.
rheahanks	training	Simon Watterman	Munchies starts in deepest darkest Peru (looks more like a dirt road to me) where archaeologist ███████████████ (Harvey Korman) & his son Paul (Charles Stratton) are on an expedition.
rheahanks	training	Trey	Eddie Murphy is hilarious as ████.
rheahanks	training	Trey Sellars	Enter ████████████, a patrolman-cum-actor who's watched way too many Police Story re-runs.
rheahanks	training	Veer-Zaara	██████████ or Lakshya (will Hrithik Roshan ever take acting lessons?) for better Indo-Pak conflict movies...
rheahanks	training	Willie Green	While he was doing time, his arch nemesis ████████████ (the same man who framed him) took over his nightclub.
rheahanks	validation	Amy	On their side, the humans have a "talking" gorilla named ███ who helps save the day at one point or another.
rheahanks	validation	Arthur	Charles Higham, in his biography THE ADVENTURES OF CONAN DOYLE suggests Sir ██████ may have picked up the code from a magazine game in the 1870s, but we really don't know.
rheahanks	validation	Atwill	Next comes Mr. ██████'s performance here - more of that later.
rheahanks	validation	Blade	A hidden enemy, hidden group of people plotting against them, the fight to save human-kind... all that is present in █████ as well.
