rheahanks	validation	Charles Higham	██████████████, in his biography THE ADVENTURES OF CONAN DOYLE suggests Sir Arthur may have picked up the code from a magazine game in the 1870s, but we really don't know.
rheahanks	validation	Chris Rock	I also liked Morgan Freeman (no surprise) and was pleasantly surprised by foul-mouthed comedian ██████████.
rheahanks	validation	CONAN DOYLE	Charles Higham, in his biography THE ADVENTURES OF ███████████ suggests Sir Arthur may have picked up the code from a magazine game in the 1870s, but we really don't know.
rheahanks	validation	Dolph Lundgren	It's difficult to take characters from comic books and put them into movies with any credibility (██████████████ as The Punisher, anyone?), but this tries very hard.
rheahanks	validation	Ed Norton	This is right around the same time she appeared with Richard Gere and █████████ in PRIMAL FEAR, a movie that helped guarantee her stardom.
rheahanks	validation	Eddie	Can't forget when █████ is on his motorbike, and he needs to urinate....
rheahanks	validation	Herman	██████ has made northern drama his own with Little Voice and Brassed Off, but the formula falters in this ropey, flat and contrived tale of two teenage delinquents trying to get season tickets to see Newcastle.
rheahanks	validation	Herman	I am all for entertainment, and ██████'s track record shows he is aware of the need to balance the social message with laughs and tears.
rheahanks	validation	Jackie	I've only seen one ██████ film worse that this one and that was one of his early forays into Hollywood films that didn't turn out so well.
rheahanks	validation	Jackie Chan	I normally love ███████████ movies but this one was terrible.
rheahanks	validation	James Cagney	This is what ████████████ is all about, wisecracks, cockiness, hard as nails and no-nonsense charisma.
rheahanks	validation	Joe	Despite all its technical short-comings, this is an interesting film depicting a day in the life of ███, a hustler, determined to earn $200 for his wife's pregnant girl friend.
rheahanks	validation	Joe	One thing is certain, ███ is uninhibited when it comes to disrobing for sex or posing for an artist.
rheahanks	validation	Joe	███ stark naked is crouching on the floor feeding crumbs of cake to his little baby.
rheahanks	validation	Joe	Another scene of amusing interest is the one in which ███ desperately seeks a loan of $100 from a gym friend, coming to the point of asking in a very circuitous approach.
rheahanks	validation	Joe	It's a preliminary to another occasion when ███ divests himself of his clothes and poses as the discus thrower in true classical style.
rheahanks	validation	Joe	At the end of the film we gain the impression that we have got to know ███ pretty well.
rheahanks	validation	Joe Dallesandro	███████████████ is outstanding as the easy-going, passive, laid-back young man who is willing to let the other person do most of the talking while he listens with a faraway look in his eyes.
rheahanks	validation	Laura Linney	████████████ of all people is along for this bumpiest of rides.
rheahanks	validation	Neil Labute	only real complaint is that director ███████████ (who made a splash a few years ago with the very impressive and dark In the Company of Men') relied much too heavily on many cliched Hollywood conventions.
rheahanks	validation	Nick Hammond	I didn't think ████████████ was Peter Parker... and he was visibly of a different build than the guy who did the stunts in the spider suit.
rheahanks	validation	Peter Parker	I didn't think Nick Hammond was ████████████... and he was visibly of a different build than the guy who did the stunts in the spider suit.
rheahanks	validation	Seth McFarlane	Reason 2, The jokes are just generally hilarious, ██████████████ and the other writers are soooooooooooo funny, everything from the Star Wars references to making fun of celebrities, i love them all.
rheahanks	validation	Stephen Dorff	█████████████ does the best job of the whole cast here, as the "head" vampire you just love to hate.
rheahanks	validation	Tobey Macguire	Granted, I can also spot in the modern Spider-Man movies when I am looking at ██████████████ and when I am looking at CGI.
rheahanks	validation	Willie Green	However, the sympathetic warden (the only white character in the whole movie that isn't completely evil or incompetent) decides to spring him free to stop the evil ████████████ and his drug trafficking.
biswas-n	training	Pleasance	Rose is good, but it's █████████ who really stands out in this film.
biswas-n	training	Capt Dan	████████ is in love with a woman.
biswas-n	training	Raul Julio	I'll always remember the name ██████████ for this picture.
biswas-n	training	Tom Selleck	You have to like baseball, and you have to at least sort of like ███████████, but if you meet those criteria you should thoroughly enjoy this movie.
biswas-n	training	Charlie Sheen	The Middle East can no longer be written off as a sthole full of rag heads knocking each other off to quote █████████████ here it is now a place in which involvement can lead to severe consequences.
biswas-n	training	James Caan	The film, however, with a strong debut for ██████████, remains effective and affecting.
biswas-n	training	Atwill	██████ is as close to cardboard in this role as he could get.
biswas-n	training	Cat Soup	████████ is one of those films that, from Western eyes, is supposed to be experienced on drugs or deeply analyzed.
biswas-n	training	Chin	The parallel Roman world dominance West and East worlds was achieved without a single towering personality like ████.
biswas-n	training	Wesley Snipes	Don't waist your time this movie snt entertaining, if you wanna cry it might suffice though, even though your tears will be wept due to seeing █████████████ in the tragic action film wannabe comedy...
biswas-n	training	Mark Mothersbough	The song when they go to the Ping Islands is a really good electronic song by █████████████████, and the second I heard it I knew I had to download it.
biswas-n	training	Vidor	I normally dislike █████, who tended to be cast in glamour roles but wasn't pretty enough to justify them.
biswas-n	training	John Cleese	Let's not forget ███████████
biswas-n	training	Jess	████ loves to play pick up soccer games, the kind forbidden by her traditionalist mother.
biswas-n	training	Daryl Hannah	Sometimes ████████████ can seem a little spacy in her film roles, but its exactly that quality that makes her so perfect in the part of Madison.
biswas-n	training	Bronson	Chief tries to scare him off, but only makes his point after ███████ has been shot and has no other choice.
biswas-n	training	Tom ValcoJames Gandolfiniis	███████████████████████████ reluctant, but is greedy enough to take Drew's offer.
biswas-n	training	Joanna Pacula	█████████████ is OK.
biswas-n	training	Oscar	I liked the part where when those two British neighbors that speak to both gentlemen, and after █████ kicked out Felix, he gets lucky and lives with them when he refused to have dinner with them the night earlier.
biswas-n	training	Fifi	Let's get to the guys who went after Goucem's neighbor ████, what is their real motivation
biswas-n	training	J. Carrol Naish	Imagine ███████████████ as an insane doctor with dentures so fake the rattle with every word that comes out of his mouth.
biswas-n	training	Ben	███ is very nervous with his new patient, who forces compliments and demands upon him.
biswas-n	training	Lawn Bowlsbr	Go see it and learn the joys of ████████████
biswas-n	training	Ian	███ believes they're trapped in a culdesac and leaves them there.
biswas-n	training	Debbie	A rather sad bit was when ██████ tried and failed to match her shouty style which spoiled it a bit.
biswas-n	training	Brendon	███████ starts out straight but gets to learn that gay may be more than just an option for him and being bisexual might not be that bad after all.
biswas-n	training	Tim Boggs	This movie would apparently be the only movie █████████ ever directed, but he did go on to work in the industry for some notable movies.The baddie of this movie is some undeveloped old man character.
biswas-n	training	Inder Kumar	After Dil, Beta, Mann and Masti, ███████████'s this flick proves that he is a king of comedy.
biswas-n	training	Hari Om	Was very fortunate to see the movie ███████ at The Bermuda International Film Festival.
biswas-n	training	Gina Gershon	Here's a little nugget made for cable that revolves around a psychiatrist played by ████████████.
biswas-n	training	Brendan Filone	██████████████ is the best.
biswas-n	training	Olsen	Getting There I found too predictable, contrived and slow, and to this day I still consider it as the █████ twins' worst.
biswas-n	training	Waldemar	Unluckily for ████████ the cave belongs to two evil Vampire, cannibal, ancient god worshipping, nymphomaniac twin sisters.
biswas-n	training	Stevens	███████, perhaps the ablest filmmaker of the era next to Hitchcock, saw the profundity and catharsis in it, and the receptive, insightful control and room to allow his particularly personal vision to make it feel like the experience cinema is meant to be, a chronicle ensuing the lifechanging happening of falling in love, and the innate personal longing to make a family and a home with the one you worship, and the trials and grief that can be as intense, though never really more, than the pleasure and gratification it begets.
biswas-n	training	Jeff	Later, ████ - This looks decidedly like "the amateur" hour.
biswas-n	training	Antwone Fisher	██████████████ stands proudly alone in this regard race is irrelevant, save for one fight that may, or may not, have been provoked by a racial slur.
biswas-n	training	Max	In conclusion, don't watch it, but if you have nothing better to do with your life and you don't feel like renting Mad ███, you might watch this, if it will ever pass on tv.
biswas-n	training	Sandra Bullock	The acting is lousy sorry, ██████████████, but even your performance was horrible, the music score could have come from a bad xrated movie and the story was downright ridiculous.
biswas-n	training	Peter O'Toole	█████████████ has either had a really bad plastic surgery, or he is desperately in need of one.
biswas-n	training	Ridley Scott's	The Thing, the movie itself, is similar to ██████████████ iconic "Alien" 1979.
biswas-n	training	Lindy	█████ is unsinkable, a positive character that makes lemonade out of lemons.
biswas-n	training	Buck Henry	The only honest performance was turned in by ██████████, who plays a raving mental patient of course, since he also wrote the screenplay for this abomination, it was probably only typecasting.
biswas-n	training	Bogdanovich	In the meantime, the budding couple's respective children nepotism alert ███████████'s daughters spew cute and pick up some fairly disturbing pointers on 'love' while observing their parents.
biswas-n	training	Camelia Kath	And as for ████████████, I've seen better looking scarecrows in farmer's fields.
biswas-n	training	Hitler	But this miniseries is powerful and convincing because the talented cast really captures the dark truth of ██████'s world.
biswas-n	training	Alain Delon	For those seeking entertainment, watch the ███████████ thrillers featured in the DVD extras.
biswas-n	training	Sticky Fingers	There were a lot of rumors that said ██████████████ couldn't act.
biswas-n	training	Alice	The only one I felt for to some degree was █████, you could literally feel the stress she's under for having to negotiate between the writer and the network guys, always pretending it's not all that bad and everything is hunkydory.
biswas-n	training	Schwarzenegger	Unlike End of Days' or The Sixth Day', classic ██████████████ action films like Predator' never insult the audience by attempting to explain the often threadbare plot.
biswas-n	training	Kareena	Well if you really listen closely, whatever they speak is actually unintelligible.Camera work is bad, editing is not present, background score gives a headache, action is shoddy, dialogs are unintelligible, Acting is abysmal and well ███████ used to look like a wrestler, now she looks like a starved wrestler.
biswas-n	validation	John Carpenter's	Hm...but not if the sponsors saw "████████████████ Vampires".
biswas-n	validation	Temujin	The main reason for this is that the story of ███████ is rooted in a culture quite alien to the filmmakers and which they make little attempt to understand.
biswas-n	validation	Nolan	A fisherman █████ is out to nab a killer whale, a very bad thing, but when he accidentally ACCIDENTALLY mark you hits a pregnant cow instead of her mate, the cow and I use the word in all senses who is obviously a sick psychobitch and the canonical villain of the piece throws herself against the propellers trying to chew herself to bits in the most distressing and hideous not to mention ineffectual method of killing herself.
biswas-n	validation	Muriel	She doesn't get many of the funnier lines, but she combines her special blend of flightiness and sauciness to make ██████ an appealing character on her own.
biswas-n	validation	Libby	My favourite episodes are the one where she turns █████ into a geek, the first episode, the true love episode and most of the rest from the first series.
biswas-n	validation	John Savage	Poor ███████████ had to stoop this low in order to be in another movie.
biswas-n	validation	Anita Strindberg	Sexy ████████████████ is absolutely ravishing in the female lead.
biswas-n	validation	Dani Levy	Director and coscriptwriter █████████ does not bother about those mechanics, he thinks that certain things simply ARE funny, the fact that two orderlies are gay and kiss over a man in a coma, for example.
biswas-n	validation	Mick McCleery	The only real problem was the lead, █████████████.
biswas-n	validation	Murphy	He turns to ██████ as an ally of convenience.
biswas-n	validation	Burakov	I was almost in tears when he told ███████ how the FBI had so closely followed and admired his work.
biswas-n	validation	Jane	Plain ████, but maybe the director was dating her or something.
biswas-n	validation	Laurence Harvey	It also helps the movie that it features ███████████████ as the movie it's prime suspect.
biswas-n	validation	Ahmed	A noble, nicelooking sorry, I had to add that in, young thief named █████ who sneaks into the palace with the help of a magic rope and tries to steal, but changes his ways when he falls for the Caliph's daughter.
biswas-n	validation	Steven Seagal	I like █████████████
biswas-n	validation	Dolittle	Dr. ████████ has ended and number 2 starts.
biswas-n	validation	George Orwell	But for English this year, year 11, we had to read Animal Farm, also by █████████████.
biswas-n	validation	Ninza Turtles	I saw very many, much was pleasant to me were a favorite "█████████████", and from "ThunderCats" I then saw only one episode about huge spiders, but they have sunk down to me in soul and later 20 years they ThunderCats is my favorite cartoon serial from serious and from comic "The Pink Panther" and I now try to extract a full serial on disks in the original without a translation into Russian.
biswas-n	validation	Stephen King 	mostly for the first 25 minsI love █████████████I read most of his books not this oneand there are some good and of course some bad
biswas-n	validation	Mike Nicholas's Closer	Law is once again reprising his similar role in ██████████████████████, which was unfortunately a disappointment to the fan of Law who wish to see something new and different from him.
biswas-n	validation	Jennifer Lopez	I don't really enjoy ██████████████.
biswas-n	validation	Meh	███, I am not going to be angry at this movie, i knew what i was getting into and if you're looking for a bad movie to watch with friends, here's what I recommend Watch this movie, then immediately watch Jurassic Park and then Lost World back to back.
biswas-n	validation	max	And even worse, the incessant, walltowall music, dull and hypnotic to the ███, opens up a giant chasm between the film and the viewer.
biswas-n	validation	Matt	Especially with her remarks about 'going to the funeral of her best friend', when she first meets ████.
biswas-n	validation	Michelle Pieffer	████████████████ is very ironic and cynical.
biswas-n	validation	Ryan	████ already in Columbia, will join the party.
biswas-n	validation	Ray Bolger	And like clowns, scarecrows can be very creepy unless they look like ██████████, of course.
biswas-n	validation	James Bond	However, it's this spoof of all spy and psychedelic series ██████████, the Man from U.N.C.L.E. and the Monkees among others which makes this series worth to watch.
biswas-n	validation	Milo	████ wants Glory back at any price.
biswas-n	validation	Gregory	First, there is very little of Ms. ███████'s book in this script.
biswas-n	testing	Scully	But The XFiles had a good thing going, and ██████ was one of the strongest and most idiosyncratic TV characters of the 90s.
biswas-n	testing	Monroe	██████ died before the movie was completed and it was canned.
biswas-n	testing	Crowe	█████ does Butch one better by blowing them all to pieces.
biswas-n	testing	Zizek	fact that █████ overfocuses on two of the most overrated directors and ones whose films often LACK intelligence, if anything such as Hitchcock and Lynch, only further diminishes his already low credibility.
biswas-n	testing	Dalton	I'm afraid the 1983 ██████ version just doesn't do anything for me.
biswas-n	testing	Keane	You begin to feel █████'s pain and anguish.
biswas-n	testing	Heather Grahm	█████████████ has done much better things since.
biswas-n	testing	Mitchell	Apparently the film takes some liberties with the true facts, but ████████ believed in the power of the airplane in war and wanted an upgrade in air power for the U.S. as well as the creation of an Air Force.
biswas-n	testing	Mermaid	I've seen other Guinea Pig films, like ███████ in a Manhole He Never Dies, and while they're pretty sick, they at least have a bit of a sense of humor to them however dark.
biswas-n	testing	Lew Ayres	█████████, who had just made a name for himself in ALL QUIET ON THE WESTERN FRONT, stars as a "nice" and "respectable" mob leader.
minhtriet136	training	Calvin	This twisted comedy is well acted and directed. Very funny and the production quality is outstanding. It is easy to see why this short film has been accepted into so many festivals and won awards. Everyone can identify with ██████ having a bad day, bad week, bad life.
minhtriet136	training	Richard Moll	████████████ brings darkness and foreboding that gives this film just the right twistedness. The old man adds to the humor of the story.
minhtriet136	training	Travis Davis	Great performances, excellent camera work and editing---this short is a classic from start to finish. Kudos to ████████████ for pulling double duty as both director and star
minhtriet136	training	Woody Allen	He's the funniest nebbish since ███████████
minhtriet136	training	Richard Moll	And what a treat to see ████████████ back again
minhtriet136	training	Stephen Garvey	This gem of a film showcases the brilliantly funny writing of ██████████████
minhtriet136	training	Steve Garvey	██████████████ is the true current king of quirky comedy.
minhtriet136	training	Suzy Parker	A sincere tribute to ███████████, who's just passed away.
minhtriet136	training	Miss Parker	Not only is TBoE one of the cheesiest movies ever made, but ███████████'s performance is, in this cheesy-movie-lover's opinion, among the worst performances of all time
minhtriet136	training	Joan Crawford	One of █████████████’s last performances as the driven successful editor vs. all those young beautiful eager beavers fresh out of the elite Seven Sister Colleges
minhtriet136	training	Robert Evans	Interesting cameo by ████████████ as a rich cad.
minhtriet136	training	Robert Evans	Here is one of the few films in which once big time producer ████████████
minhtriet136	training	Joan Crawford	It also features a mature █████████████ and terrific supporting cast. Check it out.
minhtriet136	training	Amanda Farrell	Then there's ██████████████ who did succeed professionally, but whose personal life has been sacrificed for an office with her name on the door
minhtriet136	training	Joan Crawford	A classic late 50's film. The superannuated headliners (█████████████ and Louis Jordan) are not at their best, but the direction, cinematography, and acting of the younger cast are compelling.
minhtriet136	training	Suzy Parker	This movie could be called a tearjerker with the saddest part involving ███████████'s character whose obsession of an ex-boyfriend leads to tragedy
minhtriet136	training	Scott Clark	Also interesting is ███████████, who plays Grant, the kid in the wheelchair
minhtriet136	training	Graves	They are also correct that one of the best performances of this movie was that of Dr. ██████
minhtriet136	training	Tex Avery	█████████'s tenure as director of cartoons for MGM was in the 1940s and 50s was one of the brightest moments in cartoon history
minhtriet136	training	Droopy	Throughout the film, despite many insane stunts, ██████ keeps up with this crook until eventually the wolf gives up because ██████ is seemingly everywhere
minhtriet136	training	Tex Avery	This animated short is a remake of one of █████████'s earlier shorts for Fred Quimby at M-G-M
minhtriet136	training	McPoodle	It manages to get most of it's laughs from the shocked reactions Joe has whenever he encounters ████████
minhtriet136	training	Simon Templar	As usual, █████████████ ("The Saint") meets a lady in distress and comes to her aid
minhtriet136	training	Paul Guilfoyle	Along the way, he meets some interesting supporting characters (this time, ██████████████ as "Pearly" Gates) and during his unraveling of this not especially compelling mystery (none of them really are)
minhtriet136	training	George Sanders	██████████████ is once again the consummate sophisticated British do-gooder and he succeeds once again in making an excellent B-detective series film
minhtriet136	training	George Sanders	██████████████ is so charming and, yes, low-key that all that talent, smarts, physical presence and above all, masculinity, seem, well, almost normal
minhtriet136	training	George Clooney	██████████████ can not begin to master the scene as Mr. Sanders does (and does without Mr. Clooney's mugging)
minhtriet136	training	Jonathan Hale	█████████████ simply is Inspector Fernack
minhtriet136	training	Paul Guilfoyle	██████████████ plays a mobster who goes straight (and drinks milk) because he cannot take the pressure
minhtriet136	training	Wendie Barrie	Story begins on an ocean liner headed to the U.S. where the Saint meets but cannot connect with █████████████
minhtriet136	training	Fernack	The Saint assists Inspector ███████ clear his name from a frame
minhtriet136	training	Kristine	I guess since ████████ was of age, it was held against her and her promising career came grinding to a halt
minhtriet136	training	Ronald Reagan	I guess its all in the timing (witness Pam Anderson's career)--but █████████████ was in charge during Kristine's debacle (we had not heard about Nancy Reagan's affairs)
