RamRao	training	Bluto	That said, one short scene in which █████ first trips through the woods (in both senses) comes close to capturing the spatial dislocation common to the psychedelic experience, and one wishes the film offered more moments like this one.
RamRao	training	Alan Partridge	But as ██████████████ once opined, "Dere's more to Oireland dan dis."
RamRao	validation	Boyd	The chemistry between ████ and Wolheim worked and the film managed to be quite entertaining.
RamRao	validation	Harold Lloyd	Oddly, however, the film managed to beat out ████████████'s film, SPEEDY, for an Oscar for Best Direction for a Comedy (a category no longer used)--as SPEEDY was a superior film in most ways (it's one of Lloyd's best films).
RamRao	validation	Milestone	Still, it's well worth a look--especially if you love silent films.<br /><br />By the way, director █████████ and Louis Walheim would team up just a few years later for another WWI picture, the great ALL QUIET ON THE WESTERN FRONT--a film that is definitely NOT a comedy.
RamRao	validation	Miramax	What have ███████ done with the original manuscript.
RamRao	validation	Simon Cowell	Created by ████████████ of American Idol fame, AGT is a talent search show which is similar in format to American Idol and the Gong Show.<br /><br />I don't normally ever watch network TV, and i'm not really big on reality shows at all, but i have been watching this because i thought it would be somewhat interesting.. turns out to be a poorly executed show that'll probably never recover from it's first season without some major changes (although it has already been renewed for a second season in '07).<br /><br />Basically it's a talent show where people from all across the u.s. audition with a unique talent.. everything from 9 year old singers to electric violinists, magic acts to rock bands, comedians to jugglers and ventriloquists, they're all here.
RamRao	validation	Mr. Koji	Since this movie is an adaptation of ████████ Suzuki's Lemonheart which is among the 3 stories contained in Ringu 0: Baasudei that was released in 1999, it's sufficient say that the director did pretty well with altering some of its contents to suit the interpretation of the previous movies (Ringu and Ringu 2) which was also unparalleled.
RamRao	validation	Sadako	I don't think the storyline was confusing at all since it mostly concentrated on ██████'s life (Derived from Lemonheart) and doesn't really focus on the curse of the video tape.
RamRao	validation	Sadako	Since I took the time to search for an informative website that clarified some of the scenes from the movie, I've accrued better understanding of the story and respect for it.<br /><br />What I truly love about this movie is the fact that they wanted us to feel sympathetic towards ██████'s character albeit the wickedness of what we see in Ringu and Ringu 2.
RamRao	validation	Yukie Nakama	Bravo to ████████████ for portraying Sadako's character effectively.
RamRao	validation	Sadako	It's designed to tell us the tragic story of ██████'s life before the cursed video tape, which exceeded from my own expectations.
RamRao	validation	Nakata Hideo	It's dramatic atmosphere haunted me and made me justify why such a character would turn out to be malevolent in Ringu.<br /><br />I can see why many are baffled by the story since the one who directed this is not ████████████ and obviously lingered a bit from the previous adaptations (I guess you might say more on the book than Ringu and Ringu 2.
RamRao	validation	Katharine	He meets a female fighter, █████████, who appears to be homeless but who can fight and defeat men twice her size.
RamRao	validation	Dublin	The two eventually team up, but ██████'s somewhat sleazy past catches up with them, causing conflict, pain, and emotional distress for both.<br /><br />I enjoy all types of fighting (the real kind) and consequently, I find myself being somewhat critical of film fight scenes, particularly when they involve obvious mismatches.
RamRao	validation	Nick Nolte	I won't go into details, but realize that it's set in a morgue (just go with that image for a second), involves really icky mental disorders, hookers, bored twenty-somethings and a serial killer.<br /><br />Perhaps ██████████'s worst role EVER.
RamRao	validation	Josh Brolin	Ewan McGregor just looks embarrassed, as do ███████████ and Patricia Arquette.
RamRao	validation	Rasen	I liked Ringu 0 better than █████, it explained more about Sadako's history.
RamRao	validation	Sadako	The actress who played ██████ was, what seemed to me, the only person that could play her.
RamRao	validation	Tartan Asia	It doesn't compare to the movies brought out by ███████████ Exteme.
RamRao	validation	Phone	Such as Tale of Two Sisters, █████, (Memento Mori, Whispering Corridors, Wishing Stairs) a trilogy, Premonition, H, Oldboy, and many others.
RamRao	validation	Ringu	If you enjoyed watching Rasen, █████ 0, █████, and █████ 2, you'll love the Tartan Asia Extreme movies.
RamRao	validation	William	███████ Boyd and Louis Wolheim are the "Two Arabian Knights" referred to in the title, humorously.
RamRao	validation	Arabia	Eventually, they find themselves on board a ship bound for ██████.
RamRao	validation	Arab	While tripping out to the Middle East, they rescue an ████ woman, Mary Astor, who turns out to be a Princess; and, of course, becomes a romantic interest for the "Two ████ian Knights".
RamRao	validation	Lewis Milestone	No points for guessing who wins the veiled Ms. Astor!<br /><br />The film is very well photographed and directed; ███████████████ has wonderful sets, and stages scenes beautifully.
RamRao	validation	Mr. Wolheim	Of the performances, ███████████ stands out - he creates a character so understandable you can almost hear him speak, trough the film is silent.
RamRao	validation	Boris Karloff	█████████████ appears as the "Purser"; watch for his big scene on ship, when Wolheim goes into a room with him for some money (what actually happens is a mystery).
RamRao	validation	Director Milestone	██████████████████ uses parades of soldiers moving to great effect; this "shower" scene is different in that several of the men don't look as Caucasian as you might expect - maybe not as many Caucasian men would agree to appear nude?
RamRao	validation	Simon	█████ Cowell manages to try another spin-off of "American Idol", despite of the failure with his previous attempt "American Inventor".<br /><br />It follows the same guidelines than "American Idol", you know, a host the three stereotypical judges, an obedient crowd for audience, and some entertaining contestants plus many more that are shown only for their humiliation on national TV, that is actually what most of the public seems to dig anyway.
RamRao	validation	Cowell	Even more, giving it is an open talent contest, half of them are singers what gives ██████ a chance for a shot closer to the "Idol" success.<br /><br />Regis Philbin does his job, he always manages to look as a nice guy, I don't think he contributes rising the show interest but is not responsible for the poor overcome either.<br /><br />Moving on.
RamRao	validation	David Hasselhoff	Let's see.<br /><br />Let me start by ████████████████ just because he is the only I know.
RamRao	testing	Brandy	And it guarantees the show will be sold in Germany too.<br /><br />Piers Morgan, who I don't have any clue who he is, takes the role of the wise and balanced judge completing his stereotype with a British accent that in America seems -wrongfully- to be synonymous of a higher intellect.<br /><br />Finally ██████.
RamRao	testing	Simon	If █████ were in this show not even the contestants would be necessary to nail its success.
RamRao	testing	Young Sadako	████████████ is part of a theater troupe, and a reporter knows who she is but the rest of the cast doesn't, at least, not yet.
RamRao	testing	Sadako	There are glimpses of ██████'s strange powers, which she can't seem to control when she's threatened.
RamRao	testing	Sadako	██████ then ends up with the leading role in the play but when the meddling reporter slips a tape in that isn't meant to be part of the play, it changes everything and ██████'s telekinetic powers are unleashed on the unsuspecting audience and cast, but stopped just short of harm to anyone....except, herself.
RamRao	testing	Ringu	!<br /><br />If you enjoy true atmosphere in films, that creeping feeling of dread usually reserved for coming face to face with your own personal phobia, then watch this and prepare yourself- the final 15 minutes may well be the most heart-stoppingly chilling 15 minutes you will ever witness.<br /><br />Just a warning though; it is slow paced, even more so than █████, a complaint many people seem to have with these movies, and the first time i watched it i wasn't sure if it was leading anywhere.
RamRao	testing	Sadako	██████ Yamamura is part of an acting school, and her first role is a few days away.
RamRao	testing	Sadako	The story also follows a journalist who has traced down ██████, she is the widow of a man who died, also under mysterious circumstances at the hands of, she believes, ██████'s estranged mother.
RamRao	testing	Sadako	██████'s mother was famed for her supposed supernatural abilities, and killed herself a short while ago.
RamRao	testing	Sadako	The journalist wants to find out the truth, and finds ██████ just before opening night.